{
  "meta": {
    "version": "v0.1.0",
    "jurisdiction_code": "BBC.v0.1.0.US",
    "domain": "BBC",
    "status": "EXPERIMENTAL",
    "stewards": [
      "TEMP_STEWARD_1",
      "TEMP_STEWARD_3"
    ],
    "changelog_ref": "codes/CHANGELOG.md#v0.1.0-us",
    "attribution": {
      "source": "Aesynth BBC Core",
      "license": "TBD"
    },
    "provenance_mode": "canonical"
  },
  "rules": [
    {
      "rule_id": "BBC-EGR-COR-001",
      "severity": "FATAL",
      "description": "Corridor egress clearance for BBC.v0.1.0.US; see codes/BBC.v0.1.0.US/bbc.rules.yaml",
      "policy_body": "file:codes/BBC.v0.1.0.US/bbc.rules.yaml#BBC-EGR-COR-001"
    }
  ],
  "schemas": {
    "plan_schema": "schemas/plan.schema.json",
    "waiver_schema": "policy/waivers.schema.json"
  },
  "documentation": {
    "help_ref": "docs/README.md#bbc-us",
    "waiver_guide": "docs/README.md#waivers"
  }
}
